{
  "array_seals": {
    "architecture-student-attempts": "e1d8135040fecf66ccfe9502645846f575234eb1b053047f09f5ad3e19a1b127",
    "combinatorial-nulls": "3463e99eb3011aa27e58ab06c064b9eab384552f9e0ff06fef405421348d0ca8",
    "endpoint-reducers": "5e231e4a0b011e363471d44a4ebce1ceb61e205d3fe31f3616fca0168322a21d",
    "fourier-condition-jobs": "68da722a68c0d05ef38c595c5bfe34526eadfb4eb5150bc37f0366da30816085",
    "gate-approval": "f93f55b06eddfd899d111daf3ba446b666807a19541cf2163e7f5762769f4ed5",
    "gate-exit": "b169ee8aa66a3ec746805d00d4cd0986e75b9c6c91ac66997665f26c02d31325",
    "gate-launch": "ba260dfd50aa3965f19885b5602dae1dbe4086701798ec85f4c521fab4b9d239",
    "gate-primary-completeness": "6dc8f9c728b51c9121d90e2b707913d5af8793abd8a5d6bd512b8c954c1ae719",
    "greedy-architecture": "32ceb89a92f6068c8bcedd58f8b0cdc7636bc718fb15a2c8bc8c7b5eb757d9f9",
    "greedy-basis-direct": "1b955da46b8745eec62fe9c95e1ba8b9a8b3c61b163028d48bd163a5042e5159",
    "greedy-basis-student": "472e07318e17978e6b2300d9c0cca2677f05b9ff5608d0470fe1cc26458ba4a4",
    "greedy-task1-direct": "ec28b9191e67b984f3c180555b2467820a4009d0e0b2e0e067b74c837aa2663b",
    "greedy-task1-student": "da03f2603f0c234e4766752dd173135af4f19dbc6ab2f4189647ce2ec704f3cf",
    "greedy-task2-direct": "c545aaaddd30d114fe6117188832278dc2c02a136c10f473d4add5d2f9d5a523",
    "greedy-task2-student": "b52dc074524c36699ddde6f2007c373464b197c9284b6cf1a251f90cc76f9473",
    "hard-ledgers-architecture": "0283c01820460882124be4c034c21e733965949bc183238c609ec69e5eb8edf1",
    "hard-ledgers-basis-direct": "7613b106da2b2886ee3ca504749aac528ab4c6d265f51a700f9203e9516a115d",
    "hard-ledgers-basis-student": "0663bb71ba974f8124c94de473b06a8aea3aa3b6da20fbdd060afc45ed08d5b1",
    "hard-ledgers-task1-direct": "c52f779ac119f243ae10bcd0a29f56556c5fcb4a793e06e3d4622e5b11342e2f",
    "hard-ledgers-task1-student": "44051c60c53f36f2b6dbc38a56dbcbbee5ef648dac270e5c924d90a59307485c",
    "hard-ledgers-task2-direct": "87ec27561aca8ef51df358dc1b506a771a4935931fa4f949b53440c08fd7a15e",
    "hard-ledgers-task2-student": "cf6154f92b21120b423354266dd6827b55b7587580e63f75a007f7e09daeb450",
    "hard-restarts-architecture": "23a546cd068f245e8ececb8490894bca4f2e697b37dbd34d98e3d6eb76b3ac6e",
    "hard-restarts-basis-direct": "bb0a1cd6531e4221bd36553cdd9caf9147830421b6774cc87be30b96bc91712a",
    "hard-restarts-basis-student": "225a63b3f7dc2b75a4c3fe9ee60d3206a990edb32f51320e0c1011094b0a9e42",
    "hard-restarts-task1-direct": "9e7c678b7d2a41907d08c9a6a3cfc7bafc9531a5db75103870a477639d7a2903",
    "hard-restarts-task1-student": "2c39c2fe6b0d2b6e1a91055c511ddb821b1575124947111ba3b9791389be2889",
    "hard-restarts-task2-direct": "48005529d80814bcbef5d13b1f5a245aca4d2ee51f64947fc433445b47856fba",
    "hard-restarts-task2-student": "1cd5607f3329626e6c2990c84e4692649b7223005da616df587649246048ed64",
    "local-perturbation-nulls": "4b15b213101d04980dc37ca785468d1f930bd291c263ba2295278343e314528a",
    "ordinary-restart-greedy-subjobs": "f4080a9ae5414b4651a420ed992b3cf054eb44b9e0029662d8b6d566e4e65797",
    "ordinary-restart-hard-subjobs": "e165b3b22ebf7c1abee506dbc1bb994417465ae86aa990680b718520f096d4ae",
    "ordinary-restart-ledgers": "f84c9e477f23a2b91e665ad3aa42ee83e215460c1ae92bb966ff7affcfa606fe",
    "protected-merge-export": "3f2e4476209fe33b73be0ea2be1e59d16f61b3807853a2c88b9b7e6e912f1ed0",
    "protected-report-reduction": "fa00568b791c33c0a6ed8fba729c3aee6fe7922064ccf5f76e7401bd4c9a2fbb",
    "stage14-qualification": "096c5e1977e77c745b0f9def09e49219af798bbd07c41d57cbdd926f34cb1224",
    "task1-student-attempts": "51494dd2ae6f09e1b87397068bd6c30cf4879b2cf50759974d36e0ccc1ba70ae",
    "task1-teachers": "8b967cc85ecdcb627cbf27d27ffe1b8ce5f22164754684425ef1982a40cae758",
    "task2-student-attempts": "89c1a53916e4eecce46f68700e75c92446d9ce8a3d01b662f256da38570a2972",
    "task2-teachers": "79e46ad002523e84b6594e9cf73235df1f807a30eecb7085c7da357aec65accf",
    "task3-admission": "3641a36466cc80afd0fae461baae9c35c0a5e09dc14db7226a63cc1b8340c739",
    "task3-endpoint-reducers": "2a67533902ab7a2bcc49fcf749efe6686ddc6ca70eb73e00b76cf22339195441",
    "task3-greedy-direct": "f532ee5f0a7911c31650c8c1d0da614919c592024ba409059063354882c8e0e9",
    "task3-greedy-student": "40e5a55b865ffcb72eb931a16cd914b85b6b879034c75545bb4ba6c09301c57b",
    "task3-hard-ledgers-direct": "c4d7e7939033c4fff053e1c292fccdc31d80d59f3c827a37c50ee71506c5b0f5",
    "task3-hard-ledgers-student": "58094363e80fa04fc073b5612ddc6689df8fd8f5b1c00e3c89ea2c83fcf79c9f",
    "task3-hard-restarts-direct": "8b9aea8c39640dad3e9268bf6d32f8d0b091842689abac0a2e74e7c0b329c9fa",
    "task3-hard-restarts-student": "90d7de773c049169e3ae3aecc0bce46914cdbafcbcf53c373e2a8cb5f9530c70",
    "task3-merge-export": "a42beb0088a21e5f032284e5a4652ee79018eb8baf2ab840866e69e8e6139ecd",
    "task3-student-attempts": "96028b0e00a971cea2675f809a573b850f8c8d45b9849b462cb5df2308a2ee75",
    "task3-teachers": "34b34e28669da198ece7f340ca75c8d3d65729e69e2fe3f72f17382d70635439",
    "task4-admission": "8756edab38ec2590a4b2b2c4c4a23e456205da8d69048a226d58066d5d837f6a",
    "task4-endpoint-reducers": "d5170e245933789773650b18fad273428a23ee67ee09a9aa23a27ffe8f167925",
    "task4-greedy-direct": "26260264915a81354f6bc562261339e964e4b8267a92ae2091fd5cef0ce8ffa5",
    "task4-greedy-student": "71a92458b9690b1674254abc19c34bd364394fca8527e781796a650dc00a4950",
    "task4-hard-ledgers-direct": "8108d772555c3bd0fb18996e8f4129dae6511721cf9e4c0271be25e9f59d2726",
    "task4-hard-ledgers-student": "1260fe1f5b5cd653b33bd097cd7962db004de03551bf273f2c30937c8b806cfc",
    "task4-hard-restarts-direct": "904b0889faddfde47afc7e0a6e87f157530ebdecce0de17822da77cd20cd03a5",
    "task4-hard-restarts-student": "9aa231625954eddae4f8871154543a58972465d8fef3f7333192dae33bcb582b",
    "task4-merge-export": "2535f56f42543084f092d1eac29baf8a1e12a934ea6bf184e72bfe8172c63f0f",
    "task4-student-attempts": "3cb0239d469c03ac174082ccae1125c7ccb3a062588fcbb490ca00e3042a0414",
    "task4-teachers": "b8a60232a1c4767cc34865c213a9ef94e3af8de151e6b245061679868083246f",
    "task5-admission": "9b3c8d106b570badbda7b9eaa0d4822e8f327ad09e7f50513cbd8f3bfdd7a4d2",
    "task5-endpoint-reducers": "f340300d79e55fc8dd8ab4b84b03d723fb24b3e05ef0aaa7f015d4e751c971d3",
    "task5-greedy-direct": "2ec048280f1e1321b5431734a45c2408a24d43d737f5d90641ca39ffdcdbe58a",
    "task5-greedy-student": "35775bd2851a5ea3781076e196fd45293af7f901849f5b4fd7d9d89a401b76e4",
    "task5-hard-ledgers-direct": "dfad490b70e56f533b11992e4e206e9da4a0cd266b1f92c3503a767d4e91379c",
    "task5-hard-ledgers-student": "48f911672bd49fef232423c8497c845394118be6da271bdc955490ee685bb00a",
    "task5-hard-restarts-direct": "04f703929d43ccdfe1adfb03bf347f2b2e3d8e7e66f9b82a6942c6c2b77d5b93",
    "task5-hard-restarts-student": "5e76f1c93bfe098af3a00359945cb5262cb55d2742a1878eeddcf32517de5e8d",
    "task5-merge-export": "f66c3eb02f7414f087ac9346f2398f36d6330f8c290cef40773adaa02266a8db",
    "task5-student-attempts": "0810e064b7c11d1490282680dea0e34cba4ee4277068d639074225aed0270876",
    "task5-teachers": "551a3d9df51aedb2ce89a376eba57001ef157bbb77a01439f2c73c456f846378",
    "tractable-calibration-shards": "08cecad193ebdf1c394b58b98e33fd41bd57a0430be7408ec26508500d909ad7",
    "tractable-teacher": "62734f7f437cfa2c3ea81d9e2d5687a8e5063e4e0110de9c06440dc0eed012cd"
  },
  "canonical_members_sha256": "adbfb30694bb984de4d8ba582cee0efb468b8f9a2fce01f6a3654b5b78b1927b",
  "counts_by_family": {
    "analysis-report-reduction": 1,
    "combinatorial-null": 60,
    "compact-merge-export": 4,
    "fourier-interchange-condition": 360,
    "greedy-discovery-ledger": 735,
    "hard-concrete-discovery-ledger": 735,
    "hard-concrete-restart": 2940,
    "human-gate": 4,
    "local-perturbation-null": 60,
    "optional-capacity-gate": 3,
    "ordinary-restart": 960,
    "ordinary-restart-ledger": 60,
    "qualification-prerequisite": 1,
    "sealed-ledger-endpoint-reducer": 1470,
    "student-attempt": 1060,
    "teacher-training": 36,
    "tractable-exact-calibration": 256
  },
  "counts_by_scope": {
    "optional_task_3_increment": 287,
    "optional_task_4_increment": 287,
    "optional_task_5_increment": 287,
    "protected_core": 7884
  },
  "counts_by_tier": {
    "tier1": 3748,
    "tier2-protected": 4136,
    "tier3-task3": 287,
    "tier3-task4": 287,
    "tier3-task5": 287
  },
  "logical_job_count": 8745,
  "ordered_identity_sha256": "abed1dd72c2624d6a7dc4689efa505b1682b27ada88a165dd76634ec88f1088e",
  "production_eligible": false,
  "schema_version": "stage13-expanded-manifest-seal/v1",
  "scientific_data": false,
  "scientific_operation_counts": {
    "combinatorial_null_draws": 600000,
    "endpoint1_reductions": 1470,
    "exact_evaluations": 661504,
    "fourier_condition_jobs": 360,
    "fourier_input_condition_trials": 92160,
    "frontier_reductions": 7350,
    "greedy_discovery_ledgers": 735,
    "hard_concrete_discovery_ledgers": 735,
    "hard_concrete_optimizer_steps": 17100000,
    "hard_concrete_restart_runs": 2940,
    "merge_export": 4,
    "ordinary_restart_subjobs": 960,
    "packing_grid_reductions": 17640,
    "report_reductions": 1,
    "student_attempts": 1060,
    "teacher_training": 36
  },
  "scientific_operation_counts_by_scope": {
    "optional_task_3_increment": {
      "endpoint1_reductions": 60,
      "exact_evaluations": 15360,
      "frontier_reductions": 300,
      "greedy_discovery_ledgers": 30,
      "hard_concrete_discovery_ledgers": 30,
      "hard_concrete_optimizer_steps": 600000,
      "hard_concrete_restart_runs": 120,
      "merge_export": 1,
      "packing_grid_reductions": 720,
      "student_attempts": 40,
      "teacher_training": 5
    },
    "optional_task_4_increment": {
      "endpoint1_reductions": 60,
      "exact_evaluations": 15360,
      "frontier_reductions": 300,
      "greedy_discovery_ledgers": 30,
      "hard_concrete_discovery_ledgers": 30,
      "hard_concrete_optimizer_steps": 600000,